{
  "title": "IELTS Academic Reading Practice Test 1",
  "duration": 3600,
  "branding": {
    "title": "IELTS Mock",
    "primaryColor": "#000000",
    "accentColor": "#dc2626"
  },
  "cta": {
    "heading": "Хотите улучшить свой результат?",
    "description": "Запишитесь на курс подготовки к IELTS и получите индивидуальный план обучения от опытных преподавателей.",
    "buttonText": "Записаться на курс",
    "buttonUrl": "https://ieltsboss.co",
    "buttonColor": "#2C54F6"
  },
  "passages": [
    {
      "id": "passage-1",
      "title": "The History of Timekeeping",
      "content": "<p>The measurement of time has been a fundamental concern of human civilizations since ancient times. Early humans tracked the passage of days by observing the sun's movement across the sky, while the phases of the moon provided a natural calendar for longer periods.</p><p>The ancient Egyptians were among the first to develop sophisticated timekeeping devices. Around 1500 BCE, they created sundials that used the shadow cast by a vertical stick to indicate the time of day. These early sundials divided daylight into twelve equal parts, though the length of each 'hour' varied with the seasons.</p><p>Water clocks, known as clepsydras, represented a significant advancement in timekeeping technology. Unlike sundials, they could measure time during the night and on cloudy days. The simplest water clocks consisted of a bowl with a small hole in the bottom; as water dripped out, markings on the inside of the bowl indicated the passage of time.</p><p>Mechanical clocks first appeared in European monasteries during the 13th century. These early devices used a system of weights and gears to mark the hours, though they were notoriously inaccurate, often losing or gaining as much as an hour per day. The invention of the pendulum clock by Christiaan Huygens in 1656 dramatically improved accuracy, reducing errors to less than a minute per day.</p><p>The development of marine chronometers in the 18th century solved one of the greatest challenges of the age: determining longitude at sea. John Harrison, a self-taught clockmaker, spent decades perfecting a timepiece that could maintain accuracy despite the rolling motion of a ship, changes in temperature, and variations in humidity.</p><p>The 20th century brought revolutionary changes to timekeeping. Quartz clocks, introduced in the 1920s, used the vibrations of a quartz crystal to keep time with unprecedented precision. By the 1960s, atomic clocks had been developed that measured time based on the vibrations of cesium atoms, achieving accuracy to within one second in millions of years.</p><p>Today, the Global Positioning System relies on a network of atomic clocks orbiting the Earth in satellites, enabling precise navigation and timing services worldwide. Modern smartphones synchronize their clocks with these satellites, giving ordinary people access to timekeeping accuracy that would have seemed miraculous to the ancient Egyptians who first divided the day into hours.</p>",
      "questionGroups": [
        {
          "id": "qg-1",
          "type": "true-false-not-given",
          "title": "Questions 1–5",
          "instruction": "Do the following statements agree with the information given in the passage? Write <strong>TRUE</strong> if the statement agrees with the information, <strong>FALSE</strong> if the statement contradicts the information, <strong>NOT GIVEN</strong> if there is no information on this.",
          "questions": [
            {
              "id": "q-1",
              "number": 1,
              "text": "The ancient Egyptians created sundials around 1500 BCE.",
              "options": [
                { "id": "true", "text": "TRUE" },
                { "id": "false", "text": "FALSE" },
                { "id": "not-given", "text": "NOT GIVEN" }
              ],
              "correctAnswer": "true",
              "explanation": "В тексте сказано: 'Around 1500 BCE, they created sundials'.",
              "passageHighlight": { "startText": "Around 1500 BCE", "endText": "indicate the time of day" }
            },
            {
              "id": "q-2",
              "number": 2,
              "text": "Water clocks were more accurate than sundials.",
              "options": [
                { "id": "true", "text": "TRUE" },
                { "id": "false", "text": "FALSE" },
                { "id": "not-given", "text": "NOT GIVEN" }
              ],
              "correctAnswer": "not-given",
              "explanation": "В тексте говорится, что водяные часы могли работать ночью и в облачные дни, но прямого сравнения точности нет.",
              "passageHighlight": { "startText": "Water clocks, known as clepsydras", "endText": "the passage of time" }
            },
            {
              "id": "q-3",
              "number": 3,
              "text": "Pendulum clocks reduced timekeeping errors to less than a minute per day.",
              "options": [
                { "id": "true", "text": "TRUE" },
                { "id": "false", "text": "FALSE" },
                { "id": "not-given", "text": "NOT GIVEN" }
              ],
              "correctAnswer": "true",
              "explanation": "В тексте прямо сказано: 'reducing errors to less than a minute per day'.",
              "passageHighlight": { "startText": "The invention of the pendulum clock", "endText": "less than a minute per day" }
            },
            {
              "id": "q-4",
              "number": 4,
              "text": "John Harrison received a large reward for inventing the marine chronometer.",
              "options": [
                { "id": "true", "text": "TRUE" },
                { "id": "false", "text": "FALSE" },
                { "id": "not-given", "text": "NOT GIVEN" }
              ],
              "correctAnswer": "not-given",
              "explanation": "В тексте не упоминается награда, полученная Харрисоном.",
              "passageHighlight": { "startText": "John Harrison, a self-taught clockmaker", "endText": "variations in humidity" }
            },
            {
              "id": "q-5",
              "number": 5,
              "text": "Quartz clocks were introduced in the 1920s.",
              "options": [
                { "id": "true", "text": "TRUE" },
                { "id": "false", "text": "FALSE" },
                { "id": "not-given", "text": "NOT GIVEN" }
              ],
              "correctAnswer": "true",
              "explanation": "В тексте сказано: 'Quartz clocks, introduced in the 1920s'.",
              "passageHighlight": { "startText": "Quartz clocks, introduced in the 1920s", "endText": "unprecedented precision" }
            }
          ]
        },
        {
          "id": "qg-2",
          "type": "multiple-choice-single",
          "title": "Questions 6–8",
          "instruction": "Choose the correct letter, <strong>A</strong>, <strong>B</strong>, <strong>C</strong> or <strong>D</strong>.",
          "questions": [
            {
              "id": "q-6",
              "number": 6,
              "text": "What was the main limitation of early mechanical clocks?",
              "options": [
                { "id": "a", "text": "A They were too expensive to produce" },
                { "id": "b", "text": "B They could only be used in monasteries" },
                { "id": "c", "text": "C They were significantly inaccurate" },
                { "id": "d", "text": "D They required constant maintenance" }
              ],
              "correctAnswer": "c",
              "explanation": "В тексте: 'they were notoriously inaccurate, often losing or gaining as much as an hour per day'.",
              "passageHighlight": { "startText": "These early devices used", "endText": "an hour per day" }
            },
            {
              "id": "q-7",
              "number": 7,
              "text": "John Harrison's main achievement was:",
              "options": [
                { "id": "a", "text": "A inventing the pendulum clock" },
                { "id": "b", "text": "B creating a reliable marine chronometer" },
                { "id": "c", "text": "C developing the first water clock" },
                { "id": "d", "text": "D improving sundial accuracy" }
              ],
              "correctAnswer": "b",
              "explanation": "Харрисон создал часы для определения долготы в море.",
              "passageHighlight": { "startText": "John Harrison, a self-taught clockmaker", "endText": "variations in humidity" }
            },
            {
              "id": "q-8",
              "number": 8,
              "text": "Modern atomic clocks measure time based on:",
              "options": [
                { "id": "a", "text": "A the vibrations of quartz crystals" },
                { "id": "b", "text": "B the movement of pendulums" },
                { "id": "c", "text": "C the vibrations of cesium atoms" },
                { "id": "d", "text": "D satellite signals" }
              ],
              "correctAnswer": "c",
              "explanation": "В тексте: 'atomic clocks had been developed that measured time based on the vibrations of cesium atoms'.",
              "passageHighlight": { "startText": "atomic clocks had been developed", "endText": "millions of years" }
            }
          ]
        },
        {
          "id": "qg-3",
          "type": "note-completion",
          "title": "Questions 9–13",
          "instruction": "Complete the notes below. Choose <strong>ONE WORD ONLY</strong> from the passage for each answer.",
          "wordLimit": "ONE WORD ONLY",
          "questions": [
            {
              "id": "q-9",
              "number": 9,
              "text": "Early humans used the sun and the _____ to track time.",
              "correctAnswer": "moon",
              "explanation": "В тексте: 'the phases of the moon provided a natural calendar'.",